ID,Comments,EN,DE,FR,ES,PTBR,ZHS,JA
,Blessing description.,,,,,,,
0,,"non-default weapons deal more damage,#but burn through more ammo.","waffen haben hoheren schaden,#verwenden aber mehr munition.","les armes font plus de dégâts,#mais consomment plus de munitions.","las armas no iniciales dañan más,#pero gastan más munición.","armas adquiridas (não iniciais) causam mais#dano, mas usam mais munição.","небазовое оружие наносит#больше урона,#но тратит больше#боезапаса.",初期武装以外の武器のダメージが上昇するが、#より多くの弾薬を消費する。
1,,"shield up now and on every new floor.#can fortify shield and when broken,#it chills enemies.",jetzt/an jedem level von schild gedeckt.#kann 2 schilde halten.#friert feinde ein beim bruch.,bouclier immédiat et à chaque nouvel étage.#peut renforcer le bouclier#gèle les ennemis en se cassant.,"escudo ahora y al iniciar un piso.#el escudo puede fortificarse y,#enfría a los enemigos al romperse.","forma escudo agora e em cada novo andar.#pode fortalecer o escudo#e quando é quebrado, ele congela os inimigos.","щит сейчас и на каждом#новом этаже.#щит можно укрепить, при#разрушении —#замораживает врагов.",取得時と、新しいフロアに入るたびにシールドを獲得。#シールドが壊れると敵に凍結を与える。
2,,shop items have 50%#chance to restock.,ladenwaren haben 50% chance#nachgestockt zu werden.,les articles du magasion ont 50 %#de chance de restockage.,los artículos de la tienda tienen un#50% de probabilidad de reabastecerse.,os itens da loja têm 50%#de chance de serem reabastecidos.,товары в магазине с 50%#шансом пополняются.,ショップのアイテムが#50%の確率で補充される。
3,,"room clear rewards are doubled,#but you can only pick one.","doppelt so viele#belohnungen beim raumklären,#nur eins kann genommen werden.","double les récompenses à la fin d'une salle,#mais tu ne peux en choisir qu'une.","doble de recompensas al despejar#una sala, pero solo una elección.","as recompensas de conclusão de sala são#duplicadas, mas você só pode escolher uma.","награды за зачистку#удваиваются,#но можно выбрать только#одну.",部屋クリア時の報酬が2つになるが、#その内1つしか選べない。
4,,enemy bullets suffer#unfortunate accidents.,feindliche projektile erleiden#unglückliche unfälle.,les balles des ennemis ont#des accidents malencontreux.,las balas enemigas sufren#accidentes desafortunados.,as balas dos inimigos sofrem#acidentes infelizes.,вражеские пули#попадают в неприятности.,敵の弾丸が#不運な事故に遭う。
5,,all shortcuts are open to you.,alle abkürzungen#sind dir offen.,tous les raccourcis s'ouvrent à toi.,te abre todos los atajos.,todos os atalhos se abrem para você.,все срезки открыты.,すべての抜け道が開いた状態になる。
6,,access forgotten places.,erreiche vergessene plätze.,accède à des lieux oubliés.,permite acceder a lugares olvidados.,permite acessar lugares esquecidos.,доступ к забытым местам.,忘れ去られた場所に行くことができる。
