ID,Comments,EN,DE,FR,ES,PTBR,ZHS,JA
562,,"yet even among the /c1powers that be/c0, the eternal one is cocooned in mystery.","aber von all den /c1mächten/c0, ist die ewige die geheimste.","pourtant, même parmi les /c1pouvoirs existants/c0, l'éternel est fardé de mystère.","incluso para los /c1poderes rectores/c0, el eterno está envuelto en misterio.","contudo, mesmo entre os /c1poderes existentes/c0, o poder eterno está envolto em mistério.","yet even among the /c1powers that be/c0, the eternal one is cocooned in mystery.",しかし、/c1力を持つ者/c0の間でさえ、その力の本質は#謎に包まれていた。
562,,its true aspect uncertain.,ihr wahrer aspekt unbekannt.,son aspect réel est incertain.,su aspecto real es incierto.,seu verdadeiro aspecto é incerto.,its true aspect uncertain.,その本質は不確かなままだ。
562,,"bereft of shape or intelligence,","ohne gestalt oder bewusstsein,","dépourvu de toute forme ou intelligence,","puesto que está desprovisto de forma o inteligencia,","desprovido de forma ou inteligência,","bereft of shape or intelligence,",異常とも言える好奇心から、形状も知性もない、
562,,we communed through its peculiar hunger for our living past.,sprachen wir durch ihren hunger für unsere lebende seelen.,nous communiions à travers sa soif de notre passé de vivant.,nos comunicamos a través de su peculiar apetito por nuestro pasado.,nos comunicamos através de seu apetite peculiar pelo nosso passado.,we communed through its peculiar hunger for our living past.,生きた過去との交流を試みていた。
562,,and knew how to exploit and contain it.,und könnten es umfassen und ausbeuten.,et savions comment l'exploiter et le contenir.,y supimos cómo aprovecharlo y contenerlo.,e a sabedoria de como explorá-lo e contê-lo.,and knew how to exploit and contain it.,そしてそれを利用し、封じ込める方法を模索した。
562,,for power eternal is not a force for good or evil,denn die ewige macht ist nicht gut oder böse,car le pouvoir éternel n'est pas une force du bien ou du mal,"pues el poder eterno no es, de por sí, una fuerza buena ni mala",pois o poder eterno não é uma força do bem ou do mal,for power eternal is not a force for good or evil,なぜなら、永遠の力は善でも悪でもなく、
562,,"and if unchecked, consumes mindlessly and indiscriminately.","und außer kontrolle, verzehrt ohne gedanke und wilkür.","et non maîtrisé, il consomme sans réfléchir et sans distinction.","y, si no se controla, lo consume todo sin hacer distinciones.","e se não for controlado, ele consome tudo de forma indiscriminada. ","and if unchecked, consumes mindlessly and indiscriminately.",野放しにしておくと際限なく無差別に消費して#しまうからだ。
,,,,,,,,
563,,"our forebearers lacked our sophistication,/p2 our know-how.","unsehren vorfahren fehlte unseres wissen,/p2 unseres know-how.","nos ancêtres n'avaient pas notre sophistication,/p2 notre savoir-faire.",nuestros antepasados eran menos sofisticados y/p2 experimentados.,"nossos antepassados não tinham a nossa sofisticação, o nosso conhecimento.","our forebearers lacked our sophistication,/p2 our know-how.",我々の先祖は洗練さに欠けていた。/p2それは我々の#教訓になった。
563,,they wasted time and effort on ornate rituals and barbaric sacrifical pacts.,sie verschwendeten zeit mit ornaten blutritualen.,ils perdaient leur temps dans des rituels inutiles et des sacrifices barbares.,desperdiciaron tiempo y esfuerzo en rituales y pactos sacrificiales atroces.,eles perderam tempo e energia em rituais e pactos cruéis de sacrifício. ,they wasted time and effort on ornate rituals and barbaric sacrifical pacts.,彼らは派手な儀式や野蛮な生贄の契約で時間を浪費した。
563,,"one day, they went too far./p2 they thought to match the greed of their patron","eines tages, gingen sie zu weit./p2 wurden zu gierig","un jour, ils allèrent trop loin./p2 pensant égaler l'avidité de leur patron.","un día, se propasaron./p2 quisieron ser igual de codiciosos que su benefactor","um dia, foram longe demais./p2 quiseram ser gananciosos como seu benfeitor ","one day, they went too far./p2 they thought to match the greed of their patron",ある日、彼らは一線を越えてしまった。/p2彼らの主人と同じくらい貪欲になり、
563,,"and were stripped from the pages of time, like we are.","und wurden den seiten der zeit entrissen, so wie wir.","ils furent démunis des pages du temps, tout comme nous.","y acabaron arrancados de las páginas del tiempo, al igual que nosotros.","e foram arrancados das páginas do tempo, como nós.","and were stripped from the pages of time, like we are.",我々のように時空のページから居場所を奪われた。
563,,"we deduced as much from their own writings, during the excavation.",so besagten unsere funde in der ausgrabung.,"c'est ce que nous avons tiré de leurs écrits, lors de l'excavation.",eso es lo que decían sus propios escritos hallados en el yacimiento.,"deduzimos isso a partir de seus próprios escritos, achados durante a escavação.","we deduced as much from their own writings, during the excavation.",これらは我々の発掘調査で発見した、彼らが残した文書から導き出された。
563,,"we knew the looming threat, should we ever loosen our vigil.","die gefahr war uns bewusst, sollten wir jemals nachlassen.",nous connaissions la menace en cas de relâchement de notre vigilance.,supimos de la amenaza que se avecinaba si cesábamos la vigilancia.,sabíamos da ameaça que surgiria se cessássemos a nossa vigília.,"we knew the looming threat, should we ever loosen our vigil.",そして我々は、少しの油断が危険を招いてしまう#ことを知った。
563,,"my old master thought it could be tricked, countered, defeated.","mein meister dachte es könne getäuscht, gekontert, besiegt werden.","mon vieux maître pensa qu'il pouvait être dupé, contré, vaincu.","mi viejo maestro creía que era posible engañarlo, anularlo y vencerlo. ","meu antigo mestre achava que era possível enganá-lo, combatê-lo, derrotá-lo.","my old master thought it could be tricked, countered, defeated.",だが私の師は、危険をうまく欺いて打ち負かすことができると考えた。
563,,he bargained most of his considerable power away in this pursuit.,er verhandelte viel von seiner macht im tausch dafür.,il sacrifia une grande partie de son pouvoir à ces fins.,empeñó la mayor parte de su considerable poder en esa búsqueda.,ele colocou quase todo o seu considerável poder nessa busca.,he bargained most of his considerable power away in this pursuit.,彼はこれを実現しようと、力のほとんどを注いだ。
563,,but it was a foolish endeavor.,aber es war ein törrichtes versuch.,mais ce fut une entreprise ridicule.,pero era un callejón sin salida.,mas seu esforço foi em vão.,but it was a foolish endeavor.,しかし、それは愚かな試みだった。
563,,"no force can penetrate it, no grand weapon can destroy it.","keine kraft kann es bewältigen, keine waffe kann es zerstören.","aucune force ne peut le pénétrer, aucune arme ne peut le détruire.",no hay fuerza que pueda penetrarlo ni arma poderosa que pueda destruirlo.,"nenhuma força pode penetrá-lo, nenhuma grande arma pode destruí-lo.","no force can penetrate it, no grand weapon can destroy it.",いかなる力も、いかに強力な武器を駆使してもそれを破壊することは不可能だ。
563,,the name says it all.,der name sagt es alles.,son nom est éloquent.,su nombre lo dice todo.,o nome diz tudo.,the name says it all.,その名がすべてを物語っている。
563,,/c2it can not end./c0,/c2es kann nicht enden./c0,/c2il est infini./c0,/c2no puede llegar a su fin./c0,/c2ele não tem fim./c0,/c2it can not end./c0,/c2それは永遠に消えない。/c0
,,,,,,,,
564,,"in the end, my master may have inadvertently doomed us all.",letztendlich hat mein meister uns alle verdammt.,"finalement, mon maître nous a peut-être tous condamnés.","a fin de cuentas, puede que mi maestro nos condenase sin querer,","no final, meu mestre, sem querer, pode ter condenado a todos nós.","in the end, my master may have inadvertently doomed us all.",結局のところ、師は私たち全員を知らぬうちに#破滅させていたかもしれない。
564,,but his goals were noble.,aber seine ziele waren edel.,mais ses objectifs étaient nobles.,pero su causa era noble.,mas suas intenções eram nobres.,but his goals were noble.,だが、彼の目的は崇高だった。
564,,should the infernal machine have been given life /c1and/c0 mind.,sollte der infernalen maschine leben /c1und/c0 geist gegeben werden.,si on avait donné vie /c1et/c0 âme à cette machine infernale.,"de habérsele otorgado vida /c1y/c0 una mente a la máquina infernal,",se a máquina infernal tivesse ganhado vida /c1e/c0 mente.,should the infernal machine have been given life /c1and/c0 mind.,黄泉の機械にも生命を、/c1そして/c0魂を与えるべき。
564,,should the new council have retained their grip on it...,hätte der neue rat eine kontrolle über sie behalten...,si le nouveau conseil avait conservé son contrôle dessus...,de haber seguido controlándola el nuevo consejo...,se o novo conselho tivesse mantido o controle sobre ele...,should the new council have retained their grip on it...,新しい評議会もその目的を継承すべきだった…。
564,,war has driven them to create a living god.,der krieg zwang sie einen eigenen gott zu erschaffen.,la guerre les a poussés à créer une divinité vivante.,la guerra los había exhortado a crear un dios viviente.,a guerra os levou a criar um deus vivo.,war has driven them to create a living god.,戦争は彼らに神を創ることを強いた。
564,,one they hoped would match the star of providence itself.,einen der dem stern der vorsehung gleich sein könnte.,"qui, l'espéraient-ils, égalerait l'étoile de la providence.",el cual pretendían que igualase a la mismísima estrella de la providencia.,um que eles esperavam ser igual à própria estrela da providência.,one they hoped would match the star of providence itself.,それがプロビデンス、すなわち神意の星に匹敵することを期待した。
564,,would our world really fare any better?,wäre das wirklicht eine bessere zukunft für diese welt?,notre monde en serait-il vraiment meilleur ?,¿de veras nuestro mundo saldría mejor parado?,será que nosso mundo realmente se sairia melhor?,would our world really fare any better?,それによって世界はより良くなれたのだろうか？
,,,,,,,,
565,,"you are a patient listener, little one.","du bist ein geduldiger zuhörer, kleiner.","tu prêtes une oreille attentive, petit.","se te da bien escuchar, navecita.","você é um ouvinte paciente, rapazinho.","you are a patient listener, little one.",君は聞き上手だな、小さきものよ。
565,,...,...,...,...,...,...,…
565,,would you like to hear a story?,willst du eine geschichte hören?,veux-tu que je te raconte une histoire ?,¿quieres escuchar una historia?,gostaria de ouvir uma história?,would you like to hear a story?,少し話しを聞いてくれないかね？
,YES PLEASE IM DYING.,,,,,,,
566,,"ah./p4 long ago. before this facility,","ah./p4 vor langer zeit. lange vor dieser einrichtung,","ah./p4 il y a bien longtemps. avant cet établissement,","ah./p4 hace mucho tiempo, antes de estas instalaciones,","hum./p4 há muito tempo. antes desta instalação existir,","ah./p4 long ago. before this facility,",あぁ。はるか昔、この施設ができる以前のこと、
566,,long before the folly of our ancestors.,lange vor den fehlern unserer vorahnen.,bien avant la folie de nos ancêtres.,"y mucho antes de la locura de nuestros ancestros,","muito antes da loucura dos nossos antepassados,",long before the folly of our ancestors.,そして我々の祖先が過ちを犯すよりもずっと前の#ことだ。
566,,"this world was said to be advanced,","war diese welt sehr fortgeschritten,","ce monde était soi-disant avancé,","dicen que este era un mundo avanzado,","este mundo era considerado avançado,","this world was said to be advanced,",この世界は非常に技術が進んでいた。
566,,rivaling even the golden age of our times.,vielleicht sogar mehr als zu meiner zeit.,rivalisant même avec l'âge d'or de notre époque.,que rivalizaba incluso con la edad dorada de nuestros tiempos.,rivalizando até mesmo com a era de ouro dos nossos tempos.,rivaling even the golden age of our times.,私たちの黄金時代の技術に匹敵するくらいだ。
566,,"it is then, that we made contact to people, not unlike us.","es war dann, als sie mit menschen wie wir ein kontakt nahmen.","nous avons alors pris contact avec des gens, semblables à nous.","entonces, entramos en contacto con una gente similar a nosotros.","foi então que estabelecemos contato com pessoas, não muito diferentes de nós.","it is then, that we made contact to people, not unlike us.",その頃、我々と似ても似つかぬ人々との接触が#あった。
566,,"and where our technology was great, their magic was yet greater.",dessen magie unserer technologie gleich war.,"notre technologie était formidable, mais leur magie l'était davantage.","y, si nuestra tecnología era fantástica, su magia era aún mejor.","e, se a nossa tecnologia era excelente, a magia deles era ainda melhor.","and where our technology was great, their magic was yet greater.",こちらは素晴らしい技術を持っていたが、彼らの#魔法はそれよりさらに偉大だった。
566,,we exchanged these gifts. a gesture i can wholeheartedly support.,dieses wissen wurde ausgetauscht. eine großartige geste.,nous échangeâmes ces dons. un geste que je seconde entièrement.,"intercambiamos esos regalos, un gesto que apoyo incondicionalmente.",trocamos esses presentes. um gesto que apoio de todo o coração.,we exchanged these gifts. a gesture i can wholeheartedly support.,彼らと知識の共有があった。大変価値のある交流#だっただろう。
566,,"and it is with their knowledge, that we have built the gates of this place.",und damit wurden die tore von diesem platz erbaut.,et c'est grâce à leur savoir que nous construisîmes les portes de ce lieu.,"y gracias a su conocimiento, pudimos construir las puertas de este lugar...",e é com o conhecimento deles que construímos os portões deste lugar.,"and it is with their knowledge, that we have built the gates of this place.",そして、彼らの知識を用いてこの場所の門が#建てられた。
566,,the gates to anywhere...,die tore zu überall...,qui mènent où qu'on veuille aller…,las puertas hacia cualquier parte...,os portões para qualquer lugar...,the gates to anywhere...,あらゆる場所に続く門だったが…
566,,but this was not to last.,aber es könnte nicht andauern.,mais cela ne durerait pas.,pero eso no duraría demasiado.,mas isso não duraria muito.,but this was not to last.,それは長くは持たなかった。
566,,"with no warning, they passed through the gates","ohne warnung, passierten sie durch die tore","sans prévenir, ils franchirent les portes","sin previo aviso, atravesaron las puertas","sem aviso, eles passaram pelos portões","with no warning, they passed through the gates",彼らは何の前触れもなく門をくぐり、
566,,wielding arms of total destruction.,und führten die waffen der vernichtung.,brandissant des armes de destruction totale.,empuñando armas de destrucción total.,empunhando armas de destruição total.,wielding arms of total destruction.,兵器を振りかざし、破壊の限りを尽くした。
566,,"and with them, they brought strange powers over time,","mit ihnen brachten sie auch seltsame kraft über zeit,","et ils apportèrent d'étranges pouvoirs sur le temps,","y, con ellas, poco a poco, fueron trayendo extraños poderes","e, com eles, trouxeram para cá poderes estranhos com o passar do tempo,","and with them, they brought strange powers over time,",加えて、時空を超える奇妙な力も行使し、
566,,denying any hope of victory.,und löschten damit jede hoffnung aus.,anéantissant tout espoir de victoire.,que negaban cualquier esperanza de victoria.,eliminando qualquer esperança de vitória.,denying any hope of victory.,勝利の望みを絶っていった。
566,,"somewhere in this carnage, the passage of souls through the gates of death",die massive passage der seelen in die tore des todes,"quelque part au milieu de ce carnage, le passage d'âmes aux portes de la mort","en mitad de la matanza, las almas que cruzaban las puertas de la muerte","em meio a toda essa carnificina, a passagem das almas pelos portões da morte","somewhere in this carnage, the passage of souls through the gates of death",この大虐殺で多くの魂が死の門をくぐったことで、
566,,must have roused the attention...,zog die aufmerksamkeit...,dût attirer l'attention...,debieron de llamar la atención...,deve ter chamado a atenção...,must have roused the attention...,力を持つ者たちから
566,,of the powers that be themselves.,der mächte aus der leere.,des pouvoirs en soi.,de los mismísimos poderes rectores.,dos próprios poderes governantes.,of the powers that be themselves.,注意を引くことになった。
566,,the sky shattered.,der himmel brach.,le ciel se brisa.,el cielo se abrió en canal.,o céu se abriu.,the sky shattered.,空はバラバラに砕けちった。
566,,and from it fell the star of providence.,und der stern der vorsehung fiel runter.,et l'étoile de la providence en tomba.,"y, de él, descendió la estrella de la providencia.",e dele caiu a estrela da providência.,and from it fell the star of providence.,そして、そこから神意の星が落ちてきた。
566,,an emissary of power eternal.,ein emissär der ewigen macht.,un émissaire du pouvoir éternel.,una emisaria del poder eterno.,um emissário do poder eterno.,an emissary of power eternal.,「永遠の力」の使者だ。
566,,"unaffected by the temporal magics, it laid waste to the invaders,","von zeitmagie unbetroffen, verheerte es die angreifer,","non affecté par la magie temporelle, il anéantit les envahisseurs,","era inmune a la magia temporal y arrasó a los invasores,","ele era imune à magia temporal e acabou com os invasores,","unaffected by the temporal magics, it laid waste to the invaders,",その使者は魔法の影響を受けず、侵略者に壊滅的な打撃を与えた。
566,,but of course...,aber natürlich...,mais bien entendu...,"pero, por supuesto...,",mas é claro...,but of course...,それだけでなく…
566,,"such are powers that be, that even their barest touch destroys.","auch das leichteste anfassen der mächte, zerstört.","avec de tels pouvoirs, le moindre impact est destructeur.",tales son los poderes rectores: lo destruyen todo al mínimo roce,que poderes tão poderosos acabariam trazendo a destruição mesmo ao menor toque.,"such are powers that be, that even their barest touch destroys.",使者は触れるだけであらゆるものを破壊した。
566,,"and their presence, corrupts.","und ihre präsenz, verdirbt.",et sa présence corrompt.,y su presencia corrompe.,e sua presença corrompe.,"and their presence, corrupts.",こうして侵略者は存在ごと滅んだ。
566,,"when the dust settled, there was not much left of anything.","am ende der schlacht, war wenig lebendes übrig.","lorsque la poussière se tassa, il ne restait plus grand-chose.","cuando el polvo se asentó, no quedaba prácticamente nada.","quando a poeira baixou, não sobrou praticamente nada.","when the dust settled, there was not much left of anything.",戦いの炎が収まった頃には、ほとんど何も残されていなかった。
566,,"yet, we survived.","und doch, wir haben überlebt.","pourtant, nous survivons.",pero nosotros sobrevivimos.,"e, ainda assim, sobrevivemos.","yet, we survived.",だが、我々は生き残った。
566,,this is how power eternal came into our world.,so kam die ewige macht in unsere welt.,c'est ainsi que le pouvoir éternel pénétra notre monde.,así es como el poder eterno vino a nuestro mundo.,foi assim que o poder eterno entrou em nosso mundo.,this is how power eternal came into our world.,こうして永遠の力がこの世界にもたらされたのだ。
566,,"and perhaps, to this day, we are paying out our debt to it.","und vielleicht, zahlen wir immer noch unsere schulden an sie aus.","et peut-être que jusqu'à ce jour, nous lui payons son dû.","y, tal vez, aún hoy, seguimos saldando nuestra deuda con él.","e talvez, até hoje, estejamos pagando a nossa dívida com ele.","and perhaps, to this day, we are paying out our debt to it.",今もなお、我々はその負債を背負っているのかも#しれない。
,,,,,,,,
567,,i admit.../p2 much of this story is merely speculation on my part.,ich muss sagen.../p2 vieles dieser geschichte ist reine konjektur.,j'avoue.../p2 une partie de cette histoire n'est que spéculation.,lo admito:/p2 gran parte de esta historia es pura especulación...,tenho que admitir.../p2 muito desta história é especulação da minha parte. ,i admit.../p2 much of this story is merely speculation on my part.,だが…/p2この話のほとんどは、私の単なる憶測に#過ぎない。
567,,"lines between sparse, ancient dots.",linien zwischen alten punkten.,des lignes entre les points ancestraux rares.,solo líneas que unen puntos dispersos y antiguos.,apenas linhas que unem pontos esparsos e antigos.,"lines between sparse, ancient dots.",まばらな過去の事実を想像でつなぎ合わせている。
567,,"but the survivors of this story,","aber die überlebenden aus der geschichte,","mais les survivants de ce récit,","pero de los testimonios de los supervivientes,","mas os sobreviventes desta história,","but the survivors of this story,",だが、砕けた空の向こう側の、
567,,"those who saw past the shattered sky, into the void itself.",die durch den zerbrochenen himmel in die leere schauten.,ceux qui ont vu le néant au-delà du ciel brisé.,"que vieron más allá del cielo abierto y contemplaron el vacío,",aqueles que viram além do céu aberto e contemplaram o próprio vazio.,"those who saw past the shattered sky, into the void itself.",虚無そのものを見たという生存者たちの証言だ。
567,,from their accounts rose a concrete prophecy.,sie sahen eine zukünftige prophezeiung.,de leurs témoignages naquit une prophétie.,surgió una profecía concreta:,de seus relatos surgiu uma profecia.,from their accounts rose a concrete prophecy.,彼らの証言からある予言が生まれた。
567,,"that when our debt is squared, the star of providence will rise again.","dass wenn unsere schulden beglichen sind, der stern aufsteigt.","lorsque notre dette sera payée, l'étoile de la providence se lèvera à nouveau.","si saldamos la deuda, la estrella de la providencia ascenderá de nuevo","que quando a nossa dívida for quitada, a estrela da providência surgirá novamente.","that when our debt is squared, the star of providence will rise again.",我々が借りを返し終えた時、神意の星が再び昇る。
567,,it will finally leave this world.,es verlässt unsere welt wieder.,elle quittera enfin ce monde.,"y, por fin, abandonará este mundo",e finalmente deixará este mundo.,it will finally leave this world.,それは私たち皆を連れて
567,,and take us all along with it.,und nimmt uns alle mit sich.,et nous emmènera tous avec elle.,y nos llevará con ella.,nos levando junto com ela.,and take us all along with it.,この世界を去るだろう。
,,,,,,,,
568,,"mmmmmm. i thank you for listening, little ship.","mmmmmm. ich danke dir für das zuhören, kleiner schiff.","mmmm. je te remercie de m'avoir écouté, petit vaisseau.","mmm, gracias por escucharme, navecita.","hum, obrigado por me ouvir, navezinha.","mmmmmm. i thank you for listening, little ship.",ふぅ、私の話を聞いてくれてありがとう、#小さき者よ。
568,,it is not every day i get to indulge myself with a little bit of lore,ich habe nicht jeden tag jemandem für das sagenerzählen,"je n'ai pas souvent l'occasion de raconter ces histoires,",no suelo pararme a hablar de mitología todos los días.,não é todo dia que posso compartilhar tanto assim tal conhecimento,it is not every day i get to indulge myself with a little bit of lore,日ごろから、こういう言い伝えにふけっている#訳ではない。
568,,you surely understand.,sicherlich verstehst du.,comme tu dois le comprendre.,seguro que lo comprendes.,tenho certeza que você entende.,you surely understand.,わかってくれていると思うが。
,Imagine caring about story.,,,,,,,
569,,"ah./p4 i see, you are busy.","ah./p4 du bist beschäftigt, ich verstehe.",ah./p4 je vois que tu es occupé.,"ah,/p4 veo que tienes mucho que hacer.","ah./p4 entendo, você está ocupado.","ah./p4 i see, you are busy.",そうか。/p4君は忙しいのだな。
569,,"you are the last legacy of my master, i will not hold you.","du bist das letzte vermächtnis meines meisters, ich werde dich nicht halten.","tu es le dernier héritage de mon maître, je ne te retiens pas.","eres el último legado de mi maestro, no te retendré.","você é o último legado do meu mestre, não impedir que vá.","you are the last legacy of my master, i will not hold you.",君は私の師が残した最後の遺産だ。
,,,,,,,,
