ID,Comments,EN,DE,FR,ES,PTBR,ZHS,JA
0,,,,,,,,
1,,set graphical options,grafische optionen,options graphiques,opciones de visualización,ajuste de opções gráficas,настройки графики,グラフィックオプションを設定
2,,set audio options,sound optionen,options audio,opciones de sonido,ajuste de opções de áudio,настройки звука,オーディオオプションを設定
3,,rebind controls#or set control mode,kontrolloptionen,options de contrôle ,opciones de control ,configurar controles,назначение клавиш и режим управления,操作の再割り当てや#操作モードを設定
4,,changes game language,wechselt die sprache,change la langue du jeu,cambia el idioma del juego,altera o idioma do jogo,смена языка игры,言語を変更
5,,change window mode,fenstereinstellung,changer le mode de fenêtre,cambia el modo de ventana,altera o modo de janela,режим окна,ウィンドウモードへ変更
6,,set window resolution,fensterauflösung,définit la résolution,ajusta la resolución,ajuste de resolução da janela,разрешение окна,ウィンドウ解像度を設定
7,,set cursor type,kursorauswahl,définit le curseur,define el tipo de cursor,definição do tipo de cursor,тип курсора,カーソルの種類を選択
8,,intensity of screen shaking,stärke des rüttelungseffekts,intensité des vibrations#de l'écran,intensidad del temblor#de pantalla,intensidade da vibração da tela,интенсивность тряски камеры,画面の揺れの強さ
9,,tones down#most flashing effects,reduziert die leuchteffekte,atténue les#effets clignotants,suaviza la mayoría#de efectos luminosos,suaviza a maioria#dos efeitos de iluminação,смягчает большинство мигающих эффектов,点滅エフェクトの#明るさを軽減
10,,volume of sound effects,lautstärke von soundeffekten,volume des effets sonores,volumen de los efectos,volume dos efeitos sonoros,громкость эффектов,効果音の音量
11,,volume of music,lautstärke der musik,volume de la musique,volumen de la música,volume da música,громкость музыки,音楽の音量
12,,rebind the controls,erlaubt die änderung#der kontrollschema,réaffecter les contrôles ,reasignar controles ,remapear controles ,назначить клавиши управления,操作を再割り当て
13,,removes the cursor#and allows dual-stick aiming,"entfernt den kursor,#erlaubt das kontroller-zielen",supprime le curseur et#permet la visée à deux sticks ,elimina el cursor para#apuntar con las palancas,remove o cursor e permite#mirar com os dois direcionais ,убирает курсор и включает прицеливание двумя#стиками,カーソルを消し#コントローラーでの照準を可能に
14,,toggles type of#directional sound,stellt den 3d sound ein,alterne le type du#son directionnel,activa o desactiva#el sonido direccional,ajuste do tipo de#som direcional,переключает тип пространственного звука,3Dサウンド#を切り替え
15,,sets scanline strength,stellt die stärke der#abtastlinien ein,définit l'intensité des#lignes de scan,define la intensidad de#las líneas de exploración,define a força#das linhas de varredura,сила линий развёртки,スキャンラインの強さを調整
16,,smoothes the pixel graphics,glättet die pixelgrafik,adoucit les graphismes#pixelisés,suaviza los gráficos#pixelados,suaviza os gráficos pixelados,сглаживание пиксельной графики,ピクセルグラフィックを滑らかにする
17,,resets controls#to default,stellt die ursprüngliche#steuerung wieder da,rétablit les commandes#par défaut,restablece los controles#por defecto,redefine os controles#para o padrão,сброс управления по умолчанию,操作設定を#元の状態にリセット
18,,sets the visibility#of the aim reticle,stellt die sichtbarkeit#der zielrichtung ein,définit la visibilité#du réticule de visée,ajusta la visibilidad#de la retícula,define a visibilidade#do retículo de mira,видимость прицела,照準方向の#見え方を調整 
19,,prevents tearing#may cause slowdown,beugt display-risse vor#kann spiel verlangsamen,évite le tearing#peut ralentir le jeu,evita artefactos#puede bajar rendimiento,evita rasgos de tela#pode causar lentidão,устраняет разрывы может снизить FPS,画像の乱れを防止#ゲームスピードが落ちる場合あり
20,,hold confirm#to erase everything,halten um den#fortschritt zurückzuseten,maintenir pour confirmer#l'effacement complet,mantén confirmar#para borrar todo,mantenha pressionado confirmar#para apagar tudo,удерживайте для полного сброса,長押しで#進行状況をリセット
21,,sets crt filter,stellt den#crt filter ein,définit le filtre ctr,ajusta el filtro crt,ajuste do filtro crt,фильтр ЭЛТ,CRTフィルター調整
22,,toggles the ui flickering,stellt das#ui-flackern ein,définit les#clignotements de l'iu,activa o desactiva el#parpadeo de la iu,ajuste da intermitência#da interface do usuário,мерцание интерфейса,UIの点滅を切り替え
23,,show player hitbox,zeigt die hitbox#des spielers,affiche la hitbox,muestra la caja de#colisión del jugador,exibe o hitbox do jogador,показывать хитбокс игрока,プレイヤーの当たり判定を表示
24,,outlines all walls,wände haben#umrisse,trace les contours#des murs,resalta todos los muros,destaca o contorno de todas as paredes,контуры стен,すべての壁の輪郭線を表示
25,,hold confirm to#restart the run,halten um#neu zu starten,maintenir confirmer#pour redémarrer la partie ,mantén confirmar para#reiniciar el intento,mantenha pressionado confirmar#para reiniciar a jogada ,удерживайте для перезапуска забега,長押しで#ゲームをリスタート
26,,bomb to scrap,bombe um zu brechen,bombe pour détruire,bomba para desechar,use a bomba para transformar em sucata,бомба в лом,ボムで破壊する
27,,enables additive blend mode#for enemy lasers,erlaubt additiven blendmodus#für feindliche laser,mode de synthèse additive#pour les lasers ennemis,modo de mezcla aditiva#para láseres enemigos,ativa o modo de mesclagem#adicional para lasers inimigos ,аддитивный режим для вражеских лазеров,敵のレーザーに#加算ブレンドモードを追加
28,,controller option#disables stick fire,kontrolleroption#schaltet auto. stickfeuern aus,option de manette#désactive le tir avec le stick,opción para mando#desactiva las palancas,opção de controle#desativa o tiro com analógico ,отключить стрельбу стиком,コントローラー設定#スティックでのショットを無効にする
29,,assist aim with a#laser pointer,zeichnet einen zielstrahl#beim zielen,aide à la visée avec#pointeur laser,puntería asistida con#puntero láser,assistência de mira com um#indicador de laser,подсветка прицела лазером,レーザーポインターで#照準アシスト
30,,enables touchscreen for#menus and aiming,erlaubt touchscreen#für menu und zielen,active l'écran tactile pour#les menus et la visée,activa la pantalla táctil#en menús y apuntado,ativa o touchscreen para#menus e mira,сенсорный экран для меню и прицела,タッチスクリーンを#メニューとエイムで有効にする
31,,controller option#disables move stick aim,kontroller option#schaltet stickbewegung aus,option de manette#désactive le stick#directionnel avec la visée,opción para mando#desactivar el apuntado#con la palanca de movimiento.,opção do controle#desativa a mira do direcional,отключить прицел стиком движения,コントローラー設定#移動スティックでのエイムを無効にする
32,,disables move stick aim,schaltet stickzielen aus,désactive le stick directionnel avec la visée,anula apunt. con palanca mov.,desativa a mira do direcional,прицел стиком движения выкл,移動スティックでのエイムを無効にする
33,,disables stick fire,schaltet auto. stickfeuern aus,désactive le stick de tir,desactiva las palancas,desativa o disparo com o botão analógico,стрельба стиком выкл,スティックでのショットを無効にする
34,,controller option#toggles vibration,kontroller option#vibration aus order an,option de manette#active/désactive la vibration,opción para mando#alterna la vibración,opção do controle#ativa/desativa a vibração,вибрация геймпада,コントローラー設定#振動の切り替え
35,,toggles vibration,vibration aus order an,active/désactive la vibration,alterna la vibración,ativa/desativa a vibração,вибрация вкл/выкл,振動の切り替え
36,,controller option#changes controller graphics,kontroller option#wechselt kontroller bild,option de manette#change l'image de la manette,opción para mando#cambia los iconos del mando,opção do controle#altera os ícones do controle,иконки кнопок геймпада,コントローラー設定#コントローラーのグラフィックを変更
37,,adjusts aim assist,schaltet zielassist.#aus and ein,active/désactive l'aide à la visée,alterna la puntería asistida,ativa/desativa a assistência de mira,помощь прицеливания,エイムアシストを切り替え
38,,controller option#adjusts aim assist,kontrolleroption#schaltet zielassist. um,option de manette#active/désactive l'aide#à la visée,opción para mando#alterna la puntería asist.,opção do controle#ativa/desativa a assistência de mira,помощь прицеливания (геймпад),コントローラー設定#エイムアシストの切り替え
39,,alters aim assist range,ändert die stärke#der zielassistänz,change la portée d'aide à la visée,ajusta el rango de asist.,altera o alcance da assistência de mira,радиус помощи прицеливания,エイムアシストの範囲を変更
40,,controller option#alters aim assist range,kontrolleroption#ändert die zielassistänz,option de manette#change la portée d'aide à la visée,opción para mando#ajusta el rango de asist.,opção do controle#altera o alcance da assistência de mira,радиус помощи (геймпад),コントローラー設定#エイムアシストの範囲を変更
41,,displays art#in the sidebars,zeigt ein hintergrund#auf den seiten,affiche un dessin#dans les barres latérales,muestra un diseño#en las barras laterales,exibe a arte#nas barras laterais,картинки на боковых панелях,両端にアートを表示
