ID,Comments,EN,DE,FR,ES,PTBR,ZHS,JA
110,,fire many more bullets#at a slower rate,feuere viel mehr schüsse#aber langsamer,tire plus de balles#à une cadence plus lente,dispara muchas más balas con menor cadencia,dispare muito mais balas#em um ritmo mais lento,fire many more bullets#at a slower rate,連射速度が下がり#より多くの弾を発射
111,,"while firing, charge a powerful laser#it fires when you stop",lade beim feuern ein laser auf#es feuert wenn du aufhörst,charge un puissant laser en tirant#il s'active en arrêtant de tirer,"mientras disparas, carga un láser#que se activa al dejar de hacerlo","enquanto dispara, carregue um laser poderoso#que dispara quando você para de atirar","while firing, charge a powerful laser#it fires when you stop",ショット中に強力なレーザーを溜め#ショットを終えると発射する
112,,walls fire lasers#after you dash into them,stürze dich auf die wände#um sie laser feuern zu lassen,les murs tirent des lasers#après avoir foncé dessus,los muros disparan láseres#al impulsarte contra ellos,paredes disparam lasers#depois que acelera contra elas,walls fire lasers#after you dash into them,壁にダッシュで突っ込むと壁がレーザーを発射する
113,,catching green bullets redirects them,fange grüne kugeln um sie umzuleiten,attrapper des balles vertes les redirige,atrapa las balas verdes y las redirige,pegue as balas verdes para redirecioná-las,catching green bullets redirects them,緑色の弾丸をキャッチして投げ返す
114,,conjure ghostly slashes on kill,beim töten werden geisterhafte schwerthiebe beschwört,conjure des lacérations spectrales à l'élimination,invoca tajos fantasmales al matar,conjurar golpes de espada#fantasmagóricos ao matar,conjure ghostly slashes on kill,敵を倒したとき、妖気のような斬撃を放つ
115,,"while you fire, a scythe chases enemies",beim feuern verfolgt eine sense deine feinde,"pendant le tir, une faux chasse les ennemis","al disparar, una guadaña persigue a los enemigos","enquanto dispara, uma foice#persegue os inimigos","while you fire, a scythe chases enemies",ショット中に、大鎌が敵を追う
116,,stop firing to recall embedded spikes,beim feuerstopp werden alle stacheln zurückgerufen,arrêter de tirer rappelle les piques plantées,recupera los pinchos al dejar de disparar,recupera espinhos#quando você para de atirar,stop firing to recall embedded spikes,ショットを止めると、スパイクを呼び戻す
117,,bullets fuse to grow stronger,schüsse schmelzen zusammen,balles renforcées par fusion,las balas se fusionan para aumentar de tamaño,balas se fundem para#ficarem mais fortes,bullets fuse to grow stronger,弾丸が融合して強化される
